{
  "$schema": "https://json-schema.org/draft/2020-12/schema",
  "type": "object",
  "required": ["name", "description", "inputs", "parameters", "outputs"],
  "properties": {
    "name": {"type": "string"},
    "description": {"type": "string"},
    "inputs": {"type": "array"},
    "parameters": {"type": "array"},
    "outputs": {"type": "array"}
  }
}
