{"name":"idg_drug_targets_2022","description":"Acquire or parse the named Enrichr IDG_Drug_Targets_2022 GMT","inputs":[{"name":"input_gmt","type":"gmt","description":"Optional cached Enrichr GMT"}],"parameters":[{"name":"timeout_seconds","type":"integer","default":60,"help":"HTTP timeout when acquiring the named Enrichr library"}],"outputs":[{"name":"genesets.gmt","description":"Deterministic IDG drug-target gene sets"},{"name":"geneset.meta.json","description":"Metadata and acquisition provenance"}]}
