{"name":"glygen_glycosylated_proteins","description":"Reconstruct GlyGen v1.12.1 glycosylated-protein gene sets","inputs":[{"name":"citation CSVs and protein masterlist","type":"csv","description":"GlyGen v1.12.1 source snapshot"}],"parameters":[{"name":"min_genes","type":"integer","default":5,"help":"Minimum unique genes per glycan"}],"outputs":[{"name":"genesets.gmt","description":"Deterministic GlyTouCan gene sets"},{"name":"geneset.meta.json","description":"Metadata and provenance inputs"}]}
