{
  "name": "signed_term_gene",
  "description": "Signed term-gene table converted to authoritative GMT gene sets",
  "inputs": [
    {
      "name": "table_tsv",
      "type": "tsv",
      "description": "Tab-delimited table with one row per term-gene association"
    }
  ],
  "parameters": [
    {"name": "term_column", "type": "string", "default": "term", "help": "Column containing the term/signature name"},
    {"name": "gene_id_column", "type": "string", "default": "gene_id", "help": "Column containing gene ids"},
    {"name": "gene_symbol_column", "type": "string", "default": "gene_symbol", "help": "Column containing gene symbols"},
    {"name": "score_column", "type": "string", "default": "score", "help": "Column containing signed or absolute score values"},
    {"name": "sign_column", "type": "string", "default": "sign", "help": "Column containing sign values; positive=up, negative=down"},
    {"name": "emit_mode", "type": "string", "default": "grouped_rows", "enum": ["grouped_rows", "ternary_matrix_notebook"], "help": "GMT emission mode. ternary_matrix_notebook collapses to one ternary sign per term-gene pair before writing Up/Down sets."},
    {"name": "gmt_name_separator", "type": "string", "default": "_", "enum": ["__", "_", " "], "help": "Separator between base term name and signed label"},
    {"name": "gmt_signed_labels", "type": "string", "default": "up_dn", "enum": ["pos_neg", "up_dn", "up_down", "Up_Down"], "help": "Signed suffix labels"},
    {"name": "gmt_description", "type": "string", "default": "na", "help": "GMT description field"},
    {"name": "gmt_preserve_names", "type": "boolean", "default": false, "help": "Preserve term spelling instead of GMT-name sanitization"},
    {"name": "gmt_prefer_symbol", "type": "boolean", "default": true, "help": "Prefer gene_symbol over gene_id in GMT emission"},
    {"name": "gmt_require_symbol", "type": "boolean", "default": true, "help": "Require gene_symbol for GMT emission"},
    {"name": "gmt_min_genes", "type": "integer", "default": 5, "help": "Minimum number of genes required to emit a set"},
    {"name": "emit_small_gene_sets", "type": "boolean", "default": false, "help": "If true, emit sets smaller than gmt_min_genes"}
  ],
  "outputs": [
    {"name": "genesets.gmt", "description": "Authoritative signed GMT library"},
    {"name": "geneset.tsv", "description": "Combined signed term-gene table"},
    {"name": "geneset.full.tsv", "description": "Full signed term-gene table"},
    {"name": "signature_summary.tsv", "description": "Per-set counts"},
    {"name": "geneset.meta.json", "description": "Metadata JSON"},
    {"name": "geneset.provenance.legacy.json", "description": "Legacy provenance graph JSON"},
    {"name": "geneset.provenance.dapper.yaml", "description": "DAPPER provenance YAML"}
  ]
}
