{
  "name": "rna_deg",
  "description": "RNA-seq differential expression table converted to signed gene programs and GMT gene sets",
  "inputs": [
    {
      "name": "deg_tsv",
      "type": "tsv",
      "description": "Differential expression table for one contrast",
      "required": true
    },
    {
      "name": "gtf",
      "type": "gtf_optional",
      "description": "Optional GTF for gene symbol/biotype annotation",
      "required": false
    }
  ],
  "parameters": [
    {"name": "signature_name", "type": "string", "default": "contrast", "help": "Label included in metadata and GMT names; default 'contrast' resolves to deg_tsv stem"},
    {"name": "gene_id_column", "type": "string", "default": "gene_id", "help": "Column containing gene identifiers"},
    {"name": "gene_symbol_column", "type": "string", "default": null, "help": "Optional symbol column override (auto-detects gene_symbol|gene_name when unset)"},
    {"name": "stat_column", "type": "string", "default": null, "help": "Signed statistic column for score_mode=stat (auto-detects stat when unset)"},
    {"name": "logfc_column", "type": "string", "default": null, "help": "Log fold-change column for logfc_times_neglog10p (auto-detects log2fc|log2FoldChange|logFC when unset)"},
    {"name": "padj_column", "type": "string", "default": null, "help": "Adjusted p-value column (auto-detects padj|FDR|adj.P.Val when unset)"},
    {"name": "pvalue_column", "type": "string", "default": null, "help": "P-value fallback column (auto-detects pvalue|PValue|P.Value when unset)"},
    {"name": "score_column", "type": "string", "default": null, "help": "Custom score column for score_mode=custom_column"},
    {"name": "score_mode", "type": "string", "default": "auto", "enum": ["auto", "stat", "logfc_times_neglog10p", "custom_column"], "help": "Signed score definition"},
    {"name": "duplicate_gene_policy", "type": "string", "default": "max_abs", "enum": ["sum", "max_abs", "mean", "last"], "help": "How duplicate gene_id rows are aggregated"},
    {"name": "neglog10p_cap", "type": "number", "default": 50.0, "help": "Cap for -log10(p) in logfc_times_neglog10p"},
    {"name": "neglog10p_eps", "type": "number", "default": 1e-300, "help": "Numerical floor for p-values"},
    {"name": "exclude_gene_regex", "type": "array[string]", "default": [], "help": "Repeatable regexes to exclude genes by symbol"},
    {"name": "disable_default_excludes", "type": "boolean", "default": false, "help": "Disable default MT/RPL/RPS symbol excludes"},
    {"name": "gtf_gene_id_field", "type": "string", "default": "gene_id", "help": "GTF attribute to use as gene_id"},
    {"name": "gtf_source", "type": "string", "default": null, "help": "Metadata source label for GTF"},
    {"name": "select", "type": "string", "default": "top_k", "enum": ["none", "top_k", "quantile", "threshold"], "help": "Selection method on abs(score)"},
    {"name": "top_k", "type": "integer", "default": 200, "help": "K for top_k selection"},
    {"name": "quantile", "type": "number", "default": 0.01, "help": "Quantile fraction when select=quantile"},
    {"name": "min_score", "type": "number", "default": 0.0, "help": "Threshold on abs(score) when select=threshold"},
    {"name": "normalize", "type": "string", "default": "within_set_l1", "enum": ["none", "l1", "within_set_l1"], "help": "Weight normalization on abs(score)"},
    {"name": "emit_full", "type": "boolean", "default": true, "help": "Write geneset.full.tsv"},
    {"name": "emit_gmt", "type": "boolean", "default": true, "help": "Write genesets.gmt"},
    {"name": "gmt_prefer_symbol", "type": "boolean", "default": true, "help": "Prefer gene_symbol tokens in GMT"},
    {"name": "gmt_require_symbol", "type": "boolean", "default": true, "help": "Drop rows without usable symbols for GMT"},
    {"name": "gmt_biotype_allowlist", "type": "string", "default": "protein_coding", "help": "Comma-separated allowed biotypes for GMT"},
    {"name": "gmt_split_signed", "type": "boolean", "default": true, "help": "Emit __pos and __neg sets from signed scores"},
    {"name": "gmt_emit_abs", "type": "boolean", "default": false, "help": "Emit an additional abs(score)-ranked GMT set family"},
    {"name": "gmt_source", "type": "string", "default": "full", "enum": ["full", "selected"], "help": "Source rows for GMT export; default full ranked table"},
    {"name": "gmt_topk_list", "type": "string", "default": "200", "help": "Comma-separated top-K GMT plans"},
    {"name": "gmt_mass_list", "type": "string", "default": "", "help": "Comma-separated HPD mass GMT plans"},
    {"name": "gmt_min_genes", "type": "integer", "default": 100, "help": "Minimum genes per GMT set"},
    {"name": "gmt_max_genes", "type": "integer", "default": 500, "help": "Maximum genes per GMT set"},
    {"name": "emit_small_gene_sets", "type": "boolean", "default": false, "help": "Emit sets below gmt_min_genes (with warning)"}
  ],
  "outputs": [
    {"name": "geneset.tsv", "description": "Selected gene program (signed score + nonnegative weight)"},
    {"name": "geneset.meta.json", "description": "Run metadata and provenance"},
    {"name": "geneset.full.tsv", "description": "Full signed score table (optional)"},
    {"name": "genesets.gmt", "description": "Directional GMT gene sets (optional)"},
    {"name": "run_summary.json", "description": "Machine-readable run summary"},
    {"name": "run_summary.txt", "description": "Human-readable run summary"}
  ]
}
