{"name":"glygen_glycan_synthesizing_enzymes_acquire","description":"Acquire and cache GlyGen glycan-detail API responses","inputs":[{"name":"accessions_tsv","type":"tsv","description":"Independent GlyTouCan accession snapshot"}],"parameters":[{"name":"retries","type":"integer","default":3,"help":"Request retry count"}],"outputs":[{"name":"glygen_api_manifest.tsv","description":"Response cache acquisition manifest"}]}
