{"name":"idg_archs4_coexp","description":"Acquire or parse the named Enrichr ARCHS4_IDG_Coexp GMT","inputs":[{"name":"input_gmt","type":"gmt","description":"Optional cached Enrichr GMT"}],"parameters":[{"name":"timeout_seconds","type":"integer","default":60,"help":"HTTP timeout when acquiring the named Enrichr library"}],"outputs":[{"name":"genesets.gmt","description":"Deterministic IDG ARCHS4 coexpression gene sets"},{"name":"geneset.meta.json","description":"Metadata and acquisition provenance"}]}
