{"name":"rumma_geo_all","description":"Orchestrate cached RummaGEO acquisition, selection, and reconstruction","inputs":[{"name":"human_gmt","type":"gmt","description":"Human RummaGEO GMT"},{"name":"mouse_gmt","type":"gmt","description":"Mouse RummaGEO GMT"},{"name":"human_gene_info","type":"tsv","description":"Pinned NCBI human gene info"},{"name":"mouse_gene_info","type":"tsv","description":"Pinned NCBI mouse gene info"},{"name":"gene_orthologs","type":"tsv","description":"Pinned NCBI orthologs"}],"parameters":[{"name":"refresh_sources","type":"boolean","default":false,"help":"Reacquire mutable upstream sources"}],"outputs":[{"name":"gene_perturbations","description":"Gene perturbation library"},{"name":"drug_perturbations","description":"Drug perturbation library"},{"name":"provenance","description":"Cached pipeline artifacts"}]}
