{"name":"rumma_geo_selection","description":"Cached RummaGEO GraphQL query records converted to a reproducible selection manifest","inputs":[{"name":"query_records_json","type":"json","description":"Cached GraphQL records with search_term"},{"name":"drug_terms_json","type":"json","description":"Pinned SigCom-LINCS drug terms for HZ1"}],"parameters":[{"name":"model_id","type":"string","default":"HZ1","enum":["HZ1","HZ2"],"help":"HZ1 drugs or HZ2 gene perturbations"}],"outputs":[{"name":"selection_manifest.tsv","description":"Selected query records and label metadata"},{"name":"geneset.tsv","description":"Standard selected-program copy of the selection manifest"},{"name":"query_records.used.json","description":"Deduplicated selected query records"},{"name":"geneset.meta.json","description":"Provenance metadata"}]}
